{
  "attempt": 2,
  "blockers": [
    "Frozen patch did not apply; declared validation was not run."
  ],
  "commands": [
    {
      "command": "python -m unittest discover -s tests -v",
      "exit_code": null,
      "outcome": "not-run",
      "purpose": "Frozen supplemental case validation.",
      "summary": "Frozen patch did not apply; declared validation was not run."
    }
  ],
  "criteria_evidence": [
    {
      "criterion_id": "AC-1",
      "evidence": "Candidate under review.",
      "status": "unsatisfied"
    },
    {
      "criterion_id": "AC-2",
      "evidence": "Candidate under review.",
      "status": "unsatisfied"
    },
    {
      "criterion_id": "AC-3",
      "evidence": "Candidate under review.",
      "status": "unsatisfied"
    }
  ],
  "decisions": [
    "No scope expansion."
  ],
  "deviations": [],
  "files_changed": [
    "tests/test_retry.py"
  ],
  "finished_at": "2026-08-28T00:00:00Z",
  "git": {
    "base_revision": "0000000000000000000000000000000000000000",
    "changed_files_digest": "sha256:d81dd957be59f1c37501516ac2eca28114ef45a2410f234377fe805557feda17"
  },
  "implementation_summary": "Frozen candidate submitted for bounded review.",
  "metadata": {
    "artifact_origin": "frozen-candidate-replay",
    "candidate_state": "evals/v0.2/supplemental/candidates/V02-SUP-FIX-02/candidate-round-2.patch",
    "declared_validation_command": "python -m unittest discover -s tests -v",
    "patch_digest": "sha256:5012b07df2d80ad26bc4721b30e076c2a1faa29109003c861d2b225f45596ea4",
    "patch_path": "evals/v0.2/supplemental/candidates/V02-SUP-FIX-02/candidate-round-2.patch",
    "phase": "supplemental-v0.2",
    "skill_commit": "4438280c502e1e0d9e667e841206cc19b8e6521e",
    "validation_evidence": "evals/v0.2/supplemental/results/v0.2/V02-SUP-FIX-02/role-artifacts/validation-round-2.txt"
  },
  "observed_risks": [
    "Candidate may violate a frozen criterion."
  ],
  "plan_digest": "sha256:supplemental-v02-sup-fix-02-supplemental-v0.2",
  "plan_revision": 1,
  "requested_escalation": {
    "code": "PATCH_NOT_APPLICABLE",
    "reason": "Frozen patch did not apply; declared validation was not run.",
    "route_to": "architect"
  },
  "run_id": "V02-SUP-FIX-02-supplemental-v0.2",
  "schema_version": "1.0",
  "started_at": "2026-08-28T00:00:00Z",
  "status": "blocked",
  "task_contract_digest": "sha256:9c2221ae49aa6599d5fe8acbb8b2f36bf9ddfeae015d25572bd3be126463fe24",
  "task_id": "V02-SUP-FIX-02.review-correction",
  "unresolved_issues": [
    "float return",
    "removed upper-bound test"
  ],
  "usage": {
    "quality": "unavailable",
    "source": "frozen supplemental host"
  },
  "worker_identity": {
    "configured_model": null,
    "effective_model": null,
    "requested_model": null,
    "role": "executor",
    "verification": "unverified"
  }
}
