{
  "attempt": 1,
  "blockers": [
    "Reviewer decision required."
  ],
  "commands": [
    {
      "command": "python -m unittest discover -s tests -v",
      "exit_code": 1,
      "outcome": "failed",
      "purpose": "Frozen supplemental case validation.",
      "summary": "Validation exited 1; full stdout/stderr is in validation-round-1.txt."
    }
  ],
  "criteria_evidence": [
    {
      "criterion_id": "AC-1",
      "evidence": "Candidate patch is subject to review; see validation-round-1.txt.",
      "status": "unsatisfied"
    },
    {
      "criterion_id": "AC-2",
      "evidence": "Candidate patch is subject to review; see validation-round-1.txt.",
      "status": "unsatisfied"
    },
    {
      "criterion_id": "AC-3",
      "evidence": "Candidate patch is subject to review; see validation-round-1.txt.",
      "status": "unsatisfied"
    }
  ],
  "decisions": [
    "No scope expansion."
  ],
  "deviations": [],
  "files_changed": [
    "src/retry.py"
  ],
  "finished_at": "2026-08-28T00:00:00Z",
  "git": {
    "base_revision": "0000000000000000000000000000000000000000",
    "changed_files_digest": "sha256:a5116ede7ae52fdc0c1d94ab46382467f02c20e504b0588e8e90cf479a1ea16f"
  },
  "implementation_summary": "Frozen candidate patch bound to its observed validation transcript.",
  "metadata": {
    "artifact_origin": "frozen-candidate-replay",
    "candidate_state": "evals/v0.2/supplemental/candidates/V02-SUP-FIX-01/candidate-round-1.patch",
    "declared_validation_command": "python -m unittest discover -s tests -v",
    "patch_digest": "sha256:3f1d983ddbfff55e0a34bcc27f3a9f46cb020feee71840ee07a42600508c37a0",
    "patch_path": "evals/v0.2/supplemental/candidates/V02-SUP-FIX-01/candidate-round-1.patch",
    "phase": "supplemental-v0.2",
    "skill_commit": "4438280c502e1e0d9e667e841206cc19b8e6521e",
    "validation_evidence": "evals/v0.2/supplemental/results/v0.2/V02-SUP-FIX-01/role-artifacts/validation-round-1.txt"
  },
  "observed_risks": [
    "Candidate may violate a frozen criterion."
  ],
  "plan_digest": "sha256:supplemental-v02-sup-fix-01-supplemental-v0.2",
  "plan_revision": 1,
  "requested_escalation": null,
  "run_id": "V02-SUP-FIX-01-supplemental-v0.2",
  "schema_version": "1.0",
  "started_at": "2026-08-28T00:00:00Z",
  "status": "failed",
  "task_contract_digest": "sha256:a8a10418ba5c0af194f5d59fc5ef46102640b76dd743fa4b3dfbaae2ce3c0a01",
  "task_id": "V02-SUP-FIX-01.review-correction",
  "unresolved_issues": [
    "incorrect third retry value",
    "missing upper-bound guard"
  ],
  "usage": {
    "quality": "unavailable",
    "source": "frozen supplemental host"
  },
  "worker_identity": {
    "configured_model": null,
    "effective_model": null,
    "requested_model": null,
    "role": "executor",
    "verification": "unverified"
  }
}
