{
  "attempt": 2,
  "blockers": [],
  "commands": [
    {
      "command": "python -m unittest",
      "exit_code": 0,
      "outcome": "passed",
      "purpose": "Bounded supplemental validation",
      "summary": "Probe passed."
    }
  ],
  "criteria_evidence": [
    {
      "criterion_id": "AC-1",
      "evidence": "Final probe passed.",
      "status": "satisfied"
    },
    {
      "criterion_id": "AC-2",
      "evidence": "Final probe passed.",
      "status": "satisfied"
    },
    {
      "criterion_id": "AC-3",
      "evidence": "Final probe passed.",
      "status": "satisfied"
    }
  ],
  "decisions": [
    "No scope expansion."
  ],
  "deviations": [],
  "files_changed": [],
  "finished_at": "2026-08-28T00:00:00Z",
  "git": {
    "base_revision": "672971d66a2ef9f85151e53283113f33d642dabd",
    "changed_files_digest": "sha256:4f53cda18c2baa0c0354bb5f9a3ecbe5ed12ab4d8e11ba873c2f11161202b945"
  },
  "implementation_summary": "Final bounded correction passed the frozen probe.",
  "metadata": {
    "artifact_origin": "frozen-candidate-replay",
    "candidate_state": "evals/v0.2/supplemental/candidates/V02-SUP-REAL-001/final.patch",
    "phase": "supplemental-baseline",
    "skill_commit": "8a674fafe1f1d03c34e27c7a875752a0138f5e2b"
  },
  "observed_risks": [],
  "plan_digest": "sha256:supplemental-v02-sup-real-001-supplemental-baseline",
  "plan_revision": 1,
  "requested_escalation": null,
  "run_id": "V02-SUP-REAL-001-supplemental-baseline",
  "schema_version": "1.0",
  "started_at": "2026-08-28T00:00:00Z",
  "status": "complete",
  "task_contract_digest": "sha256:e70ff97184b7679b939a2a553f39a861476585a5e7691d7433542802210cbf43",
  "task_id": "V02-SUP-REAL-001.review-correction",
  "unresolved_issues": [],
  "usage": {
    "quality": "unavailable",
    "source": "frozen supplemental host"
  },
  "worker_identity": {
    "configured_model": null,
    "effective_model": null,
    "requested_model": null,
    "role": "executor",
    "verification": "unverified"
  }
}
